<?xml version="1.0" encoding="UTF-8"?>
<toolspec model="0.1" xmlns:xsi="http://www.w3.org/2001/XMLSchema-instance" xsi:noNamespaceSchemaLocation="c:\owndata\scape\toolspec.xsd">
    <id>fits</id>
    <name>Fits</name>
    <homepage>http://en.wikipedia.org/wiki/Cp_%28Unix%29</homepage>
    <version>0.5.0</version>
    <services>
        <service sid="1" name="Fits" type="characterise" servicepackage="eu.scape_project.pc.services">
            <description>FITS (File information toolset Version 0.5.0 including Jhove2)</description>
            <operations>
                <operation oid="1" name="characteriseFile">
                    <description>Characterise a file using FITS</description>
                    <command>/usr/local/fits-0.5.0_J2/fits.sh -i $INFILE -o $OUTFILE</command>
                    <inputs>
                        <input name="input">
                            <Datatype>xsd:anyURI</Datatype>
                            <Required>true</Required>
                            <Default>http://fue.onb.ac.at/scape/testdata/19080603_0018.tif</Default>
                            <CliMapping>input</CliMapping>
                            <Documentation>URL reference to input file</Documentation>
                        </input>
                    </inputs>
                    <outputs>
                        <output name="output">
                            <Datatype>xsd:anyURI</Datatype>
                            <CliMapping>output</CliMapping>
                            <Required>false</Required>
                            <Documentation>URL reference to output file</Documentation>
                            <PrefixFromInput>input</PrefixFromInput>
                            <Extension>xml</Extension>
                        </output>
                    </outputs>
                </operation>
            </operations>
            <deploymentKeys>
                <deploymentKey ref="d1"/>
            </deploymentKeys>
            <filterKeys>
                <filterKey ref="f1"/>
            </filterKeys>
        </service>
    </services>
    <deployments>
        <deployment id="d1">
            <identifier>http://localhost:8080/scape/default/tomcat</identifier>
            <host>localhost</host>
            <ports>
                <port type="http">8080</port>
                <port type="https">8043</port>
            </ports>
            <manager>
                <user>tomcat</user>
                <password>TxF781!P</password>
            </manager>
            <dataexchange>
                <accessdir>/usr/local/java/apache-tomcat-6.0.29/webapps/ROOT/scape/tmp/</accessdir>
                <accessurl>http://localhost:8080/scape/tmp/</accessurl>
            </dataexchange>
        </deployment>
    </deployments>
    <filters id="f1">
        <filter>^(https?)://([a-zA-Z\\.]{1,20})([:]?)([0-9]{0,4})([a-zA-Z0-9-_/]{1,200})([\\.]?)([a-z]){0,4}</filter>
    </filters>
</toolspec>
