<?xml version="1.0" encoding="UTF-8"?>
<toolspec model="0.1" xmlns:xsi="http://www.w3.org/2001/XMLSchema-instance" xsi:noNamespaceSchemaLocation="c:\owndata\scape\toolspec.xsd">
    <id>tesseract</id>
    <name>Tesseract</name>
    <homepage>http://en.wikipedia.org/wiki/Cp_%28Unix%29</homepage>
    <version>2.0.1</version>
    <installation>
        <os type="linux">
           
        </os>
        <os type="windows">
            
        </os>
    </installation>
    <services>
        <service sid="1" name="Tesseract" type="migrate" servicepackage="eu.scape_project.pc.services">
            <description>Service for copying files</description>
            <operations>
                <operation oid="1" name="ocr">
                    <description>OCR a TIFF image file</description>
                    <command>/usr/bin/tesseract ${input} ${output} -l ${langmod} </command>
                    <inputs>
                        <input name="input">
                            <Datatype>xsd:anyURI</Datatype>
                            <Required>true</Required>
                            <Default>http://localhost:8080/scape/testdata/bookpage.tif</Default>
                            <CliMapping>input</CliMapping>
                            <Documentation>URL reference to input file</Documentation>
                        </input>
                        <input name="langmod">
                            <Datatype>xsd:string</Datatype>
                            <Required>true</Required>
                            <Default>spa</Default>
                            <CliMapping>langmod</CliMapping>
                            <Documentation>Language module to be used by tesseract</Documentation>
                        </input>
                    </inputs>
                    <outputs>
                        <output name="output">
                            <Datatype>xsd:anyURI</Datatype>
                            <CliMapping>output</CliMapping>
                            <Required>false</Required>
                            <Documentation>URL reference to output file</Documentation>
                            <Extension>txt</Extension>
                            <AutoExtension>true</AutoExtension>
                        </output>
                    </outputs>
                </operation>
            </operations>
            <deployto>
                <deployref default="true" ref="local"/>
            </deployto>
        </service>
    </services>
    <deployments>
        <deployment id="local">
            <identifier>http://localhost:8080/scape/default/tomcat1</identifier>
            <host>localhost</host>
            <ports>
                <port type="http">8080</port>
                <port type="https">8043</port>
            </ports>
            <manager>
                <user>tomcat</user>
                <password>tomcat</password>
		<path>manager</path>
            </manager>
            <dataexchange>
                <accessdir>/usr/local/java/apache-tomcat-6.0.29/webapps/ROOT/scape/tmp/</accessdir>
                <accessurl>http://localhost:8080/scape/tmp/</accessurl>
            </dataexchange>
        </deployment>
    </deployments>
</toolspec>
