<?xml version="1.0" encoding="UTF-8"?>
<toolspec model="0.1" xmlns:xsi="http://www.w3.org/2001/XMLSchema-instance" xsi:noNamespaceSchemaLocation="../src/main/resources/toolspec.xsd">
    <id>openjpeg</id>
    <name>OpenJPEG</name>
    <homepage>http://code.google.com/p/openjpeg/</homepage>
    <version>1.4</version>
    <installation>
        <os type="linux">
            Linux:
            Download: http://openjpeg.googlecode.com/files/openjpeg_v1_4_linux.tgz
            The libtiff and libjpeg must be available on your system.
            OpenJPEG requires at least symbolic links to the libraries at
            /usr/lib/libtiff.so and /usr/lib/libjpeg.so.
            If the libtiff/libjpeg libraries are installed but not available at
            these locations, set symbolic links, e.g.
            sudo ln -s /usr/lib/libjpeg.so.8 /usr/lib/libjpeg.so
            and
            /usr/lib/i386-linux-gnu/libtiff.so.4 /usr/lib/libtiff.so
        </os>
        <os type="windows">
            Windows:
            Download: http://openjpeg.googlecode.com/files/openjpeg_v1_4_win32.zip
        </os>
    </installation>
    <services>
        <service sid="1" name="OpenJPEG" type="migrate" servicepackage="eu.scape_project.pc.services" contextpathprefix="/scapeservices">
            <description>Service for converting a Grayscale/RGB TIFF image to JPEG2000 (JP2)</description>
            <operations>
                <operation oid="1" name="convertTiffImageToJp2">
                    <description>Convert a Grayscale/RGB TIFF image to JP2 (Non Grayscale/RGB TIFF not supported!)</description>
                    <command>/usr/local/openjpeg_v1_4/bin/image_to_j2k -i ${input} -o ${output} -r ${compression} -t ${tileSize} -n ${resolutions} -b ${codeBlockSize} -p ${progressionOrder}</command>
                    <inputs>
                        <input name="input">
                            <Datatype>xsd:anyURI</Datatype>
                            <Required>true</Required>
                            <CliMapping>input</CliMapping>
                            <Documentation>URL reference to input file</Documentation>
                            <Default>http://fue.onb.ac.at/scape/testdata/19080603_0018.tif</Default>
                        </input>
                        <input name="compression">
                            <Datatype>xsd:string</Datatype>
                            <Required>true</Required>
                            <CliMapping>compression</CliMapping>
                            <Documentation>Different compression ratios for successive layers - The rate specified for each quality level is the desired compression factor. Example: 20,10,1 means compress 20x, 10x, and lossless.</Documentation>
                            <Default>20,10,1</Default>
                        </input>
                        <input name="resolutions">
                            <Datatype>xsd:int</Datatype>
                            <Required>true</Required>
                            <CliMapping>resolutions</CliMapping>
                            <Documentation>Number of resolutions</Documentation>
                            <Default>3</Default>
                        </input>
                        <input name="tileSize">
                            <Datatype>xsd:string</Datatype>
                            <Required>true</Required>
                            <CliMapping>tileSize</CliMapping>
                            <Documentation>Size of tile, e.g. 512,512</Documentation>
                            <Default>512,512</Default>
                        </input>
                        <input name="codeBlockSize">
                            <Datatype>xsd:string</Datatype>
                            <Required>true</Required>
                            <CliMapping>codeBlockSize</CliMapping>
                            <Documentation>Size of code block, e.g. 32,32</Documentation>
                            <Default>32,32</Default>
                        </input>
                        <input name="progressionOrder">
                            <Datatype>xsd:string</Datatype>
                            <Required>true</Required>
                            <CliMapping>progressionOrder</CliMapping>
                            <Documentation>Progression order, e.g. LRCP, one of LRCP, RLCP, RPCL, PCRL, CPRL</Documentation>
                            <Default>LRCP</Default>
                        </input>
                    </inputs>
                    <outputs>
                        <output name="output">
                            <Datatype>xsd:anyURI</Datatype>
                            <Required>false</Required>
                            <CliMapping>output</CliMapping>
                            <Documentation>URL reference to output file</Documentation>
                            <PrefixFromInput>input</PrefixFromInput>
                            <Extension>jp2</Extension>
                        </output>
                    </outputs>
                </operation>
                <operation oid="2" name="simpleConvertTiffImageToJp2">
                    <description>Convert a Grayscale/RGB TIFF image to JP2 (Non Grayscale/RGB TIFF not supported!)</description>
                    <command>/usr/local/openjpeg_v1_4/bin/image_to_j2k -i ${input} -o ${output}</command>
                    <inputs>
                        <input name="input">
                            <Datatype>xsd:anyURI</Datatype>
                            <Required>true</Required>
                            <CliMapping>input</CliMapping>
                            <Documentation>URL reference to input file</Documentation>
                            <Default>http://fue.onb.ac.at/scape/testdata/19080603_0018.tif</Default>
                        </input>
                    </inputs>
                    <outputs>
                        <output name="output">
                            <Datatype>xsd:anyURI</Datatype>
                            <Required>false</Required>
                            <CliMapping>output</CliMapping>
                            <Documentation>URL reference to output file</Documentation>
                            <PrefixFromInput>input</PrefixFromInput>
                            <Extension>jp2</Extension>
                        </output>
                    </outputs>
                </operation>
            </operations>
            <deployto>
                <deployref default="true" ref="deployment1"/>
            </deployto>
        </service>
    </services>
    <deployments>
        <deployment id="deployment1">
            <identifier>http://localhost:8080/scape/default/tomcat</identifier>
            <host>localhost</host>
            <ports>
                <port type="http">8080</port>
                <port type="https">8043</port>
            </ports>
            <manager>
                <user>tomcat</user>
                <password>TxF781!P</password>
		<path>manager</path>
            </manager>
            <toolsbasedir></toolsbasedir>
            <dataexchange>
                <accessdir>/usr/local/java/apache-tomcat-6.0.29/webapps/ROOT/scape/tmp/</accessdir>
                <accessurl>http://localhost:8080/scape/tmp/</accessurl>
            </dataexchange>
        </deployment>
    </deployments>
</toolspec>
