<?xml version="1.0" encoding="UTF-8"?>
<toolspec model="0.1" xmlns:xsi="http://www.w3.org/2001/XMLSchema-instance"
    xsi:noNamespaceSchemaLocation="../scape-core/src/main/resources/eu/scape_project/core/model/toolspec/toolspec.xsd">
    <id>convert</id>
    <name>SoX - Sound eXchange (audio2wav)</name>
    <homepage>http://sox.sourceforge.net/</homepage>
    <version>1.0</version>
    <installation>
        <os type="linux">
            tomcat6,sox
        </os>
        <os type="windows">
            Install sox
        </os>
    </installation>
    <services>
        <service sid="1" name="sox-audio2wav" type="migrate"
            servicepackage="eu.scape_project.pc.services" contextpathprefix="/scapeservices">
            <description>SoX convertion service (audio2wav)</description>
            <operations>
                <operation oid="1" name="convert">
                    <description>Converts any SoX supported audio format to WAV</description>
                    <command>sox ${input} ${output}</command>
                    <inputs>
                        <input name="input">
                            <Datatype>xsd:anyURI</Datatype>
                            <Required>true</Required>
                            <CliMapping>input</CliMapping>
                            <Documentation>URL reference to input file</Documentation>
                            <Default>http://localhost:8080/scape/testdata/audio.flac</Default>
                        </input>
                    </inputs>
                    <outputs>
                        <output name="output">
                            <Datatype>xsd:anyURI</Datatype>
                            <Required>false</Required>
                            <CliMapping>output</CliMapping>
                            <Documentation>URL reference to output file</Documentation>
                            <PrefixFromInput>input</PrefixFromInput>
                            <Extension>wav</Extension>
                        </output>
                    </outputs>
                </operation>                
            </operations>
            <deployto>
                <deployref default="true" ref="local"/>
            </deployto>
        </service>

    </services>
    <deployments>
        <deployment id="local">
            <identifier>http://localhost:8080</identifier>
            <host>localhost</host>
            <ports>
                <port type="http">8080</port>
                <port type="https">8043</port>
            </ports>
            <manager>
                <user>tomcat</user>
                <password>tomcat</password>
                <path>manager</path>
            </manager>
            <toolsbasedir></toolsbasedir>
            <dataexchange>
                <accessdir>/var/lib/tomcat6/webapps/scape/tmp/</accessdir>
                <accessurl>http://localhost:8080/scape/tmp/</accessurl>
            </dataexchange>
        </deployment>
    </deployments>
</toolspec>
