<?xml version="1.0" encoding="UTF-8"?>
<toolspec model="0.1" xmlns:xsi="http://www.w3.org/2001/XMLSchema-instance" xsi:noNamespaceSchemaLocation="c:\owndata\scape\toolspec.xsd">
    <id>droid</id>
    <name>DROID</name>
    <homepage>http://sourceforge.net/apps/mediawiki/droid/</homepage>
    <version>6.0.1</version>
    <installation>
        <os type="linux">
            Install DROID in any directory.
            Edit the examples/droid601-wrapper.sh script to match the DROID installation.
            Edit this file, especailly the 
                services/service/operations/operation/command
            and the 
                deployments/deployment/dataexchange/accessdir
            parameters.
        </os>
    </installation>
    <services>
        <service sid="1" name="Droid" type="characterise" servicepackage="eu.scape_project.pc.services">
            <description>Service for running a DROID characterisation one one file</description>
            <operations>
                <operation oid="1" name="droid">
                    <description>Runs DROID on a single file</description>
                    <command>/usr/local/java/droid/droid601/droid601-wrapper.sh ${input} ${output}</command>
                    <inputs>
                        <input name="input">
                            <Datatype>xsd:anyURI</Datatype>
                            <Required>true</Required>
                            <Default>http://localhost:8080/scape/testdata/scape-logo.png</Default>
                            <CliMapping>input</CliMapping>
                            <Documentation>URL reference to input file</Documentation>
                        </input>
                    </inputs>
                    <outputs>
                        <output name="output">
                            <Datatype>xsd:anyURI</Datatype>
                            <CliMapping>output</CliMapping>
                            <Required>false</Required>
                            <Documentation>URL reference to output file</Documentation>
                            <PrefixFromInput>input</PrefixFromInput>
                            <Extension>csv</Extension>
                        </output>
                    </outputs>
                </operation>
            </operations>
            <deployto>
                <deployref default="true" ref="local"/>
            </deployto>
        </service>
    </services>
    <deployments>
        <deployment id="local">
            <identifier>http://localhost:8080/scape/default/tomcat1</identifier>
            <host>localhost</host>
            <ports>
                <port type="http">8080</port>
                <port type="https">8043</port>
            </ports>
            <manager>
                <user>tomcat</user>
                <password>tomcat</password>
		<path>manager</path>
            </manager>
            <dataexchange>
                <accessdir>/usr/local/java/apache-tomcat-6.0.29/webapps/ROOT/scape/tmp/</accessdir>
                <accessurl>http://localhost:8080/scape/tmp/</accessurl>
            </dataexchange>
        </deployment>
    </deployments>
</toolspec>
