<?xml version="1.0" encoding="UTF-8"?>
<toolspec model="0.1" xmlns:xsi="http://www.w3.org/2001/XMLSchema-instance"
    xsi:noNamespaceSchemaLocation="../xa-toolwrapper/src/main/resources/toolspec.xsd">
    <id>convert</id>
    <name>Mencoder's convert</name>
    <homepage>http://www.mplayerhq.hu/</homepage>
    <version>1.0</version>
    <installation>
        <os type="linux">
            Install Mencoder
        </os>
        <os type="windows">
            Install Mencoder
        </os>
    </installation>
    <services>
        <service sid="1" name="Mencoder" type="migrate"
            servicepackage="eu.scape_project.pc.services" contextpathprefix="/scapeservices">
            <description>Mencoder convertion service</description>
            <operations>
                
                <operation oid="1" name="video2mpeg2">
                    <description>Converts any Mencoder supported video format to MPEG2</description>
                    <command>mencoder -quiet -of mpeg -ovc lavc -oac lavc -lavcopts vcodec=mpeg2video:acodec=ac3 ${input} -o ${output}</command>
                    <inputs>
                        <input name="input">
                            <Datatype>xsd:anyURI</Datatype>
                            <Required>true</Required>
                            <Default>http://localhost:8080/scape/testdata/video/big_buck_bunny_480p_stereo.ogg.flv</Default>
                            <CliMapping>input</CliMapping>
                            <Documentation>URL reference to input file</Documentation>
                        </input>
                    </inputs>
                    <outputs>
                        <output name="output">
                            <Datatype>xsd:anyURI</Datatype>
                            <CliMapping>output</CliMapping>
                            <Required>false</Required>
                            <Documentation>URL reference to output file</Documentation>
                            <PrefixFromInput>input</PrefixFromInput>
                            <Extension>mpeg</Extension>
                        </output>
                    </outputs>
                </operation>
                
            </operations>
            <deployto>
                <deployref default="true" ref="local"/>
            </deployto>
        </service>

    </services>
    <deployments>
        <deployment id="local">
            <identifier>http://localhost:8080/scape/instances/tomcat1</identifier>
            <host>localhost</host>
            <ports>
                <port type="http">8080</port>
                <port type="https">8043</port>
            </ports>
            <manager>
                <user>tomcat</user>
                <password>tomcat</password>
                <path>manager</path>
            </manager>
            <dataexchange>
                <!--<accessdir>../webapps/ROOT/scape/tmp/</accessdir>-->
                <accessdir>webapps/ROOT/scape/tmp/</accessdir>
                <accessurl>http://localhost:8080/scape/tmp/</accessurl>
            </dataexchange>
        </deployment>
    </deployments>
</toolspec>
