<?xml version="1.0" encoding="UTF-8"?>
<toolspec model="0.1" xmlns:xsi="http://www.w3.org/2001/XMLSchema-instance"
          xsi:noNamespaceSchemaLocation="c:\owndata\scape\toolspec.xsd">
    <id>migrationQA</id>
    <name>migrationQA</name>
    <homepage>TODO</homepage>
    <version>1.0</version>
    <installation>
        <os type="linux">
            TODO
        </os>
        <os type="windows">
            TODO
        </os>
    </installation>
    <services>
        <service sid="1" name="migrationQA" type="compare" servicepackage="eu.scape_project.pc.services">
            <description>Service for comparing audio files</description>
            <operations>
                <operation oid="1" name="migrationQA">
                    <description>Compares two wav files</description>
                    <command>migrationQA.sh ${file1} ${file2} ${output}</command>
                    <inputs>
                        <input name="file1">
                            <Datatype>xsd:anyURI</Datatype>
                            <Required>true</Required>
                            <Default>http://iapetus:9441/scape-data/test-data/sample1.wav</Default>
                            <CliMapping>file1</CliMapping>
                            <Documentation>URL reference to wav input file 1</Documentation>
                        </input>
                      <input name="file2">
                          <Datatype>xsd:anyURI</Datatype>
                          <Required>true</Required>
                          <Default>http://iapetus:9441/scape-data/test-data/sample2.wav</Default>
                          <CliMapping>file2</CliMapping>
                          <Documentation>URL reference to wav input file 2</Documentation>
                      </input>
                    </inputs>
                    <outputs>
                        <output name="output">
                            <Datatype>xsd:anyURI</Datatype>
                            <CliMapping>output</CliMapping>
                            <Required>false</Required>
                            <Documentation>URL reference to output from system.out</Documentation>
                            <PrefixFromInput>file1</PrefixFromInput>
                            <Extension>txt</Extension>
                        </output>
                    </outputs>
                </operation>
            </operations>
            <deployto>
                <deployref default="true" ref="iapetus"/>
            </deployto>
        </service>
    </services>
    <deployments>
        <deployment id="local">
            <identifier>http://localhost:8080/scape/instances/tomcat1</identifier>
            <host>localhost</host>
            <ports>
                <port type="http">8080</port>
                <port type="https">8043</port>
            </ports>
            <manager>
                <user>tomcat</user>
                <password>password</password>
                <path>manager</path>
            </manager>
            <toolsbasedir></toolsbasedir>
            <dataexchange>
                <accessdir>webapps/ROOT/scape/tmp/</accessdir>
                <accessurl>http://localhost:8080/scape/tmp/</accessurl>
            </dataexchange>
        </deployment>
        <deployment id="iapetus">
            <identifier>http://iapetus:9441/</identifier>
            <host>iapetus</host>
            <ports>
                <port type="http">9441</port>
            </ports>
            <manager>
                <user>tomcat</user>
                <password>password</password>
                <path>manager</path>
            </manager>
            <toolsbasedir>/home/scape/tools/migrationQA/</toolsbasedir>
            <dataexchange>
                <accessdir>services/webapps/scape-data/migrationQA-output/</accessdir>
                <accessurl>http://iapetus:9441/scape-data/migrationQA-output/</accessurl>
            </dataexchange>
        </deployment>
    </deployments>
</toolspec>
